"648144035740282880","Sun Sep 27 14:35:54 +0000 2015","Hillary is on @meetthepress this morning, check your local listings and tune in. http://t.co/lCGmRuU2uo"
"648153337280471040","Sun Sep 27 15:12:52 +0000 2015","Hillary on her vision for the country: http://t.co/rspNDPyGc8"
"648181714057998336","Sun Sep 27 17:05:37 +0000 2015","You should not have to be the grandchild of a former president to know that you can make it in America.
https://t.co/4BzHfPli2x"
"648210745704976385","Sun Sep 27 19:00:59 +0000 2015",".@amyschumer and @lenadunham stopped by HQ: http://t.co/GCydyb9Mfd"
"648265876525875200","Sun Sep 27 22:40:03 +0000 2015","Women’s rights are human rights, period. Join Women for Hillary today.
https://t.co/zewoKIuRAJ"
"648308931371122688","Mon Sep 28 01:31:08 +0000 2015","Powerful to see @POTUS sit with federal prisoners for this important conversation. It's time to end mass incarceration. #VICEonHBO"
"648473836719964160","Mon Sep 28 12:26:25 +0000 2015","Families are working harder than ever, but paychecks have barely budged. That needs to change.
https://t.co/pb6Yk6Rhir"
"648548117353209856","Mon Sep 28 17:21:35 +0000 2015","Hillary’s hosting a Facebook Q&amp;A this afternoon! Leave your question here: http://t.co/cTFL9SCLYb http://t.co/BYO5Jy6Lom"
"648581200458612736","Mon Sep 28 19:33:02 +0000 2015",".@NASA has found water on Mars. There is no limit to what we can discover when we explore, ask questions, and listen to science."
"648603651611623424","Mon Sep 28 21:02:15 +0000 2015","Wishing all Korean Americans and their families a safe and happy Chuseok!"
"648657431799668736","Tue Sep 29 00:35:57 +0000 2015","During a Facebook Q&amp;A, Hillary responded to Jeb's claim that Democrats appeal to African Americans with ""free stuff"": http://t.co/o7YVMNXkru"
"648661300646674432","Tue Sep 29 00:51:20 +0000 2015","El Papa Francisco tiene razón. Todos los países...tienen la responsabilidad de prevenir el cambio climático. http://t.co/SIBx6iUX7l"
"648830263317794816","Tue Sep 29 12:02:44 +0000 2015","When Republicans attack Planned Parenthood, they’re attacking women’s health. Proud to #StandWithPP—and always will.
https://t.co/frqgxI6sjG"
"648889162440015872","Tue Sep 29 15:56:46 +0000 2015","Excited to be part of @lennyletter's first issue! Read Hillary's interview with @lenadunham: http://t.co/MTOp7YMZ1S http://t.co/UcrkdYZFYv"
"648943368840605696","Tue Sep 29 19:32:10 +0000 2015","Health care, college affordability, and pumpkin spice lattes—read everything you missed from Hillary’s Facebook Q&amp;A: http://t.co/cu4KW6rQEx"
"648947770615836672","Tue Sep 29 19:49:40 +0000 2015","For nearly 100 yrs, Planned Parenthood has stood up to political attacks on women's health while providing care. GOP: You're outmatched. -H"
"648967322120658945","Tue Sep 29 21:07:21 +0000 2015","#PinkOut for @PPFA because they provide quality, affordable health care to those who need it most. #StandWithPP http://t.co/smM6J6N91B"
"648989588338384896","Tue Sep 29 22:35:50 +0000 2015","In school, I learned how to think creatively and stand up for myself. #62MillionGirls don't have that chance. http://t.co/BKNW3A0Oqc -H"
"649193820244996096","Wed Sep 30 12:07:22 +0000 2015","“Nobody in America should have to choose between buying the medicine they need and paying their rent.” -Hillary
https://t.co/HmGeuX2vKz"
"649239685768810496","Wed Sep 30 15:09:38 +0000 2015","You shouldn't have to worry about your paycheck or your job when you have a baby or someone in your family gets sick."
"649382296366264321","Thu Oct 01 00:36:19 +0000 2015","In case you were wondering, you should be following hillaryclinton on Snapchat. 👻 http://t.co/eigWQMKXjj"
"649573475645005827","Thu Oct 01 13:15:59 +0000 2015","The United States is the only country in the developed world without guaranteed paid leave. That has to change. http://t.co/qafJ7MrTRi"
"649706544704167936","Thu Oct 01 22:04:45 +0000 2015","Another devastating shooting. We need sensible gun control measures to save lives, and I will do everything I can to achieve that. -H"
"649778426841317376","Fri Oct 02 02:50:23 +0000 2015","Proud to have @wendydavis on Team Hillary. http://t.co/Ck3TxLbCL5"
"649960501909278720","Fri Oct 02 14:53:53 +0000 2015","Yet another reason we need to restore key protections of the Voting Rights Act. We're better than this. -H https://t.co/HYM1j2irkm"
"650054410387746816","Fri Oct 02 21:07:03 +0000 2015","""What is wrong with us that we can't stand up to the NRA and the gun lobby and the gun manufacturers they represent?"" -Hillary"
"650054874068058112","Fri Oct 02 21:08:54 +0000 2015","""We don't just need to pray...We need to act...Republicans and the NRA say, now is not the time to talk about guns. Yes, it is."" -Hillary"
"650055634298236928","Fri Oct 02 21:11:55 +0000 2015","""Republicans keep refusing to do anything to protect our communities. They put the NRA ahead of American families. It is wrong."" -Hillary"
"650388619925041153","Sat Oct 03 19:15:05 +0000 2015","""We need to say with one voice that transgender people are valued, they are loved, they are us"" -Hillary at @HRC today"
"650389396785623041","Sat Oct 03 19:18:10 +0000 2015","""Eleven states ban same-sex couples and LGBT individuals from adopting....one of the cruelest vestiges of anti-gay bigotry."" -Hillary"
"650389907429527552","Sat Oct 03 19:20:12 +0000 2015","""As President, I will push to cut off federal funding for any public child welfare agency that discriminates against LGBT people."" -Hillary"
"650390705437863936","Sat Oct 03 19:23:22 +0000 2015","""It’s outrageous that, in 2015, you can still be fired for being gay...this kind of discrimination goes against everything we stand for."""
"650391843235065857","Sat Oct 03 19:27:53 +0000 2015","""Congress must pass the Federal Equality Act [to] finally outlaw discrimination against LGBT people basically everywhere."" -Hillary"
"650416782621155328","Sat Oct 03 21:06:59 +0000 2015","Hillary on the epidemic of gun violence. http://t.co/FkAaVf0WpC"
"650520412477083648","Sun Oct 04 03:58:47 +0000 2015","A vote for Hillary is a vote for four more years of Kate McKinnon's impression. #citizens http://t.co/8WFlf1dy9n"
"650658585031131136","Sun Oct 04 13:07:49 +0000 2015","""Let us then tap our fists in friendship."" http://t.co/RkRru8dqNE"
"650733950806196225","Sun Oct 04 18:07:18 +0000 2015","We can’t wait any longer to act on gun violence prevention. http://t.co/EZrJVtu8OC"
"650784369012031488","Sun Oct 04 21:27:39 +0000 2015","LGBT rights are human rights and human rights are LGBT rights -- period. http://t.co/Plj2NjuRHD"
"650815385764241408","Sun Oct 04 23:30:54 +0000 2015","In this week's Facebook Q&amp;A, Hillary took on Jeb’s claim that Democrats use ""free stuff"" to appeal to minorities. http://t.co/nx2FrUKl5G"
"651069652865581056","Mon Oct 05 16:21:16 +0000 2015","It's time to act on gun violence. We simply cannot accept as normal 33,000 gun deaths a year. -H"
"651069880746307584","Mon Oct 05 16:22:10 +0000 2015","As president, I'll push to close background check loopholes like the ""Charleston loophole"" that let the shooter get a gun. -H"
"651070235349487620","Mon Oct 05 16:23:35 +0000 2015","If Congress refuses to act to end this epidemic of gun violence, I'll take administrative action to do so. -H"
"651094785982394368","Mon Oct 05 18:01:08 +0000 2015","It’s time to act on gun violence. http://t.co/V6RP1utuy3"
"651105559354167296","Mon Oct 05 18:43:56 +0000 2015","We cannot sit by while more people die. http://t.co/oeWiP3rg4Z"
"651202369326198787","Tue Oct 06 01:08:38 +0000 2015","Protecting communities should be our number one priority—not the interests of the NRA. http://t.co/FkAaMqJSNN"
"651368063376297985","Tue Oct 06 12:07:02 +0000 2015","“It's time for us to say, we're better than this."" Hillary's plan to prevent gun violence: http://t.co/2DB7SLJujT http://t.co/xhJW1eY9sB"
"651462669657112577","Tue Oct 06 18:22:58 +0000 2015","Being a good parent has nothing to do with sexual orientation or gender identity. http://t.co/q7Qg338Oln"
"651500938943967232","Tue Oct 06 20:55:02 +0000 2015","Hillary’s commonsense steps will help reduce gun violence and save lives, say @GabbyGiffords and @ShuttleCDRKelly. http://t.co/Q6kczch6Cy"
"651569964382597120","Wed Oct 07 01:29:19 +0000 2015","We need comprehensive immigration reform with a real path to full citizenship. There is no place in America for second-class citizenship."
"651730456711294976","Wed Oct 07 12:07:04 +0000 2015","Add your name if you think it’s time to take action on gun violence: http://t.co/d5G3nBLwbw http://t.co/L2y4gtp9pO"
"651784323130093568","Wed Oct 07 15:41:06 +0000 2015","Sorry about the mean tweets you’ve been getting, @KevinMcCarthy—been there! https://t.co/HAwL2D56xu"
"651828195864518656","Wed Oct 07 18:35:26 +0000 2015","Republicans say they don’t think Hillary has accomplished anything—so she sent them a gift. http://t.co/nO5hZUCEkI http://t.co/EJerPjx4TX"
"651911204328341504","Thu Oct 08 00:05:17 +0000 2015","It’s time to end discrimination against LGBT Americans once and for all. http://t.co/9gcJwDFS1Y"
"651947444742127616","Thu Oct 08 02:29:18 +0000 2015","""You were great on Saturday Night Live...so, can you do for us the Donald Trump impression?""
https://t.co/3V4sZMZEY1"
"651965024798294016","Thu Oct 08 03:39:09 +0000 2015","Hillary on standing up to the NRA: “We can’t just say, OK, nothing we can do about it...We have got to fight back.”
https://t.co/kwRJpE13mp"
"652247844217311232","Thu Oct 08 22:22:58 +0000 2015",".@NRA Stop taking advantage of responsible gun owners who want commonsense reform—including many of your own members."
"652286195032915968","Fri Oct 09 00:55:22 +0000 2015","An important question from a young man: “Can you fix the prison problems?”
https://t.co/yDCR348i5G"
"652302972714508288","Fri Oct 09 02:02:02 +0000 2015","If you work on Wall Street and commit a crime, you deserve to go to jail. http://t.co/3ZwT2C7MjG http://t.co/eoA6jneibw"
"652454986463363072","Fri Oct 09 12:06:05 +0000 2015","Thank you, @repjohnlewis. http://t.co/qGmkKWf6UP"
"652579924478291968","Fri Oct 09 20:22:33 +0000 2015","Ever sent a kid to college? Hillary talks about how she and Bill handled dropping Chelsea off the first time:
https://t.co/LcqpYLHPDT"
"652591497221640194","Fri Oct 09 21:08:32 +0000 2015","Racism is America's original sin. To those I met with today, thank you for sharing your ideas. -H https://t.co/ICqYepExxB"
"652616099482181632","Fri Oct 09 22:46:17 +0000 2015","¡Gracias @DoloresHuerta por apoyar a Hillary Clinton! Para escuchar el mensaje de Dolores, envía HUERTA al 47246."
"652626732655050752","Fri Oct 09 23:28:32 +0000 2015","Last week, Hillary joined @MarcAnthony on stage at his concert in Miami. Thanks for the warm welcome, Marc!
https://t.co/JeTgFK1oBH"
"652641274550452224","Sat Oct 10 00:26:19 +0000 2015",".@people is right, we can’t give up. It’s time to act on gun violence. https://t.co/YvHxXm9hNm"
"652838725139976193","Sat Oct 10 13:30:55 +0000 2015","We can protect the Second Amendment while also protecting our families and communities from gun violence. http://t.co/4UBTUq9Po2"
"652918902142431232","Sat Oct 10 18:49:31 +0000 2015","This #WorldMentalHealthDay, let's commit to ending stigma and making sure those who seek treatment are supported and taken seriously."
"652939703273017344","Sat Oct 10 20:12:10 +0000 2015",".@KatyPerry’s coming to Iowa to support Hillary! RSVP for the Des Moines rally here: http://t.co/6Q3mAppXUq https://t.co/yPQwnegc9j"
"652955198856499200","Sat Oct 10 21:13:45 +0000 2015","Thank you, @JerryBrownGov. Every state should follow your lead and make it easier to vote.
https://t.co/HWarCEXN8B"
"653010917429411840","Sun Oct 11 00:55:09 +0000 2015","The Republicans are spending millions to try and stop her, but Hillary will never quit fighting for you.
https://t.co/tgwEW7iFQT"
"653206170467987456","Sun Oct 11 13:51:01 +0000 2015","On #NationalComingOutDay, we remember that our work isn’t done until everyone can be who they are and is treated with dignity."
"653237461024382976","Sun Oct 11 15:55:21 +0000 2015","40 years ago, I married the cute guy from the library. Happy anniversary, @billclinton—you've still got it! -H http://t.co/H6AaXAKdek"
"653258596478676993","Sun Oct 11 17:19:21 +0000 2015","""You will surprise yourself with what you’re capable of and the incredible things you [do]."" #NationalComingOutDay
https://t.co/Ks0VR4Xomt"
"653283679389773824","Sun Oct 11 18:59:01 +0000 2015","Just 30% of girls around the world are enrolled in secondary school. Together, we can change that: http://t.co/Ai12QdbJX0 #DayoftheGirl"
"653342714851893248","Sun Oct 11 22:53:36 +0000 2015","Honored to have Congressman @repjohnlewis's support. http://t.co/vIxs9BLRMg"
"653380271954223104","Mon Oct 12 01:22:50 +0000 2015","When Hillary’s mother Dorothy needed a champion, someone was there. Today, Hillary’s fighting for all the Dorothys.
https://t.co/spHT5JgRmH"
"653592446140555264","Mon Oct 12 15:25:56 +0000 2015","Sending support to Tamir Rice's loved ones. Too many black families are mourning the loss of a child. We need to change that reality. -H"
"653608762620686336","Mon Oct 12 16:30:47 +0000 2015","We’re not going to “get over it,” @JohnKasich, we’re going to protect Social Security for the next generation. https://t.co/IZrT8dWPRS"
"653630349738512384","Mon Oct 12 17:56:33 +0000 2015",".@Pharrell: “It’s Hillary time.” http://t.co/fWqT513Esg
https://t.co/kpJ7qdn8SY"
"653653786364350465","Mon Oct 12 19:29:41 +0000 2015","“As a woman...you’re expected to be both strong and vulnerable at the same time. That’s not easy to do.” -Hillary http://t.co/kLCYETQ9MG"
"653677442347986944","Mon Oct 12 21:03:41 +0000 2015","Thoughts and prayers aren’t enough—we must act to protect families from gun violence. http://t.co/KDBBuXp6W5"
"653708850126848001","Mon Oct 12 23:08:29 +0000 2015","“One of the merits is I am a woman.” http://t.co/v3W8c6sASU"
"653733796408377344","Tue Oct 13 00:47:37 +0000 2015","Hillary's been debating important issues since high school. Let her know you’re on her team: http://t.co/QPIWimMvL1 http://t.co/aAFnSIcGwK"
"653755711252484096","Tue Oct 13 02:14:42 +0000 2015","Hillary talks sexism in the workplace with @Buzzfeed’s @AnotherRound: http://t.co/R4FNFAWCJY http://t.co/Ustefl9Sjw"
"653906095006720000","Tue Oct 13 12:12:16 +0000 2015","Today we celebrate Dolores Huerta—teacher, organizer, activist—for her civic leadership and trailblazing spirit. http://t.co/5rWRDcy3O1"
"653974078198521857","Tue Oct 13 16:42:25 +0000 2015",".@realDonaldTrump Glad you'll be watching. It's going to be ""huge."""
"654029848462106625","Tue Oct 13 20:24:01 +0000 2015","One third of black men born today face the prospect of incarceration in their lifetimes. We can do better. http://t.co/2vtiRQZd9v"
"654093999972724736","Wed Oct 14 00:38:56 +0000 2015","Let's do this. #DemDebate http://t.co/y31OQXaa9b"
"654099821935116288","Wed Oct 14 01:02:04 +0000 2015","""I've spent my entire adult life looking for ways to even the odds...to allow each child to live up to its potential."" -Hillary #DemDebate"
"654099993930936326","Wed Oct 14 01:02:45 +0000 2015","""I'm a progressive, but I'm a progressive who gets things done."" -Hillary #DemDebate"
"654102594185490432","Wed Oct 14 01:13:05 +0000 2015","We can't wait any longer to act on gun violence prevention. #DemDebate"
"654103102598062080","Wed Oct 14 01:15:06 +0000 2015","""This has gone on too long, and it's time that the entire country stood up against the NRA."" -Hillary on gun violence #DemDebate"
"654103747702980608","Wed Oct 14 01:17:40 +0000 2015","We can protect the Second Amendment while also protecting our families and communities from gun violence. #DemDebate"
"654106145158787072","Wed Oct 14 01:27:12 +0000 2015","We can't allow guns to fall into the hands of domestic abusers, violent criminals, and the seriously mentally ill. http://t.co/PeHPnhuV6K"
"654108036542369792","Wed Oct 14 01:34:43 +0000 2015","“President Obama asked me to be his Secretary of State. He valued my judgment."" -Hillary #DemDebate"
"654111672446132224","Wed Oct 14 01:49:10 +0000 2015","""[Benghazi] committee is basically an arm of the RNC—I intend to keep talking about the issues that matter to the American people."" -Hillary"
"654112940929511424","Wed Oct 14 01:54:12 +0000 2015","""We need to tackle mass incarceration."" -Hillary #DemDebate"
"654113179711242240","Wed Oct 14 01:55:09 +0000 2015","We cannot keep imprisoning more people than anyone else in the world. #DemDebate"
"654113430111133696","Wed Oct 14 01:56:09 +0000 2015","We can't move forward until we tackle racial inequality that still exists—from economic opportunity to education to community safety."
"654113744436502528","Wed Oct 14 01:57:24 +0000 2015","Racial inequality is not merely a symptom of economic inequality."
"654115156444753920","Wed Oct 14 02:03:00 +0000 2015","No one is too big to jail–even on Wall Street. #DemDebate"
"654117057349459968","Wed Oct 14 02:10:34 +0000 2015","We need to make college more affordable. http://t.co/McCVDVPPXi"
"654117344978059265","Wed Oct 14 02:11:42 +0000 2015","No student should have to borrow money to pay tuition at a public college. http://t.co/7DIAKMjrr4"
"654119591535321088","Wed Oct 14 02:20:38 +0000 2015","There is no place in America for second-class citizenship. #DemDebate http://t.co/vlE5KChnzO"
"654122869492944897","Wed Oct 14 02:33:39 +0000 2015","It's time the entire country stood up against the NRA. http://t.co/l1MEhGvtwt #DemDebate"
"654123422474240000","Wed Oct 14 02:35:51 +0000 2015","""I can't think of anything more outsider than being the first woman president."" -Hillary #DemDebate"
"654125001344450560","Wed Oct 14 02:42:08 +0000 2015","Equal pay, paid leave, childcare: These aren't just ""women's issues,"" they're family issues and economic growth issues. #DemDebate"
"654125318656139265","Wed Oct 14 02:43:23 +0000 2015","No matter what @carlyfiorina says, paid family leave is good for women, good for families, and good for America. #DemDebate"
"654125779446562816","Wed Oct 14 02:45:13 +0000 2015","No politician should interfere with a woman's personal medical decisions. Full stop. #DemDebate #ImWithHer"
"654126218548264960","Wed Oct 14 02:46:58 +0000 2015","For too long, issues affecting women—from reproductive rights to paid leave—have been dismissed as ""women's issues."" Those days are over."
"654126832669851648","Wed Oct 14 02:49:24 +0000 2015","Attacks on Planned Parenthood are attacks on women's health and rights. We can't let them take us backwards. http://t.co/AwABjhfCjg"
"654127367984709632","Wed Oct 14 02:51:32 +0000 2015","We cannot afford to have a Republican succeed Barack Obama as President of the United States. #DemDebate"
"654127977660350465","Wed Oct 14 02:53:57 +0000 2015","Hillary on the enemies she's proud to have made: ""The NRA, health insurance companies, drug companies, the Iranians...and the Republicans."""
"654128669292666880","Wed Oct 14 02:56:42 +0000 2015","Hillary has fought for women her whole life—and she's just getting started. #ImWithHer #DemDebate http://t.co/vr1z1APQxJ"
"654129724990603265","Wed Oct 14 03:00:54 +0000 2015","""In this debate, we tried to deal with the very tough issues facing our country—in stark contrast to the Republicans."" -Hillary #DemDebate"
"654130163425366017","Wed Oct 14 03:02:38 +0000 2015","We cannot go back to the failed policies of the past. We will not go back. America's best days are still ahead. #DemDebate"
"654130570314797056","Wed Oct 14 03:04:15 +0000 2015","Are you with Hillary? Let her know: http://t.co/cpNtT9GLNf #DemDebate #ImWithHer http://t.co/67aQwmoeoy"
"654131224185802752","Wed Oct 14 03:06:51 +0000 2015","RT this if you’re proud to stand with Hillary. #ImWithHer #DemDebate http://t.co/gNnlOqnBq3"
"654135901870657537","Wed Oct 14 03:25:26 +0000 2015","A highlight of #DemDebate: Hillary stands up against Republican attacks on women's rights. #ImWithHer
https://t.co/9OBNNSpaRf"
"654148384295522304","Wed Oct 14 04:15:02 +0000 2015","“Finally, fathers will be able to say to their daughters: you too can grow up to be president.” #DemDebate
https://t.co/pan4VXnmgT"
"654266399162937344","Wed Oct 14 12:03:59 +0000 2015","Last night, Hillary showed that she has the vision, the plans, and the determination to move this country forward.
https://t.co/lKhqx4Q3a5"
"654366668190273536","Wed Oct 14 18:42:25 +0000 2015","We can protect the Second Amendment while also protecting our families and communities from gun violence. http://t.co/K3DN9ORtrk"
"654425087790219264","Wed Oct 14 22:34:34 +0000 2015","The feeling when a GOP candidate says it's acceptable to be fired for being gay. https://t.co/cF9mw5k8fq http://t.co/cYFvcW27mQ"
"654458002326491136","Thu Oct 15 00:45:21 +0000 2015","She has a point: The economy does do better with a Democrat in the White House.
https://t.co/ijhQK1uNGs"
"654772215754330116","Thu Oct 15 21:33:55 +0000 2015","To everyone who's ever been bullied for being who you are: You're perfect, and I'm proud of you. #SpiritDay -H"
"654805621091401728","Thu Oct 15 23:46:40 +0000 2015","Women still make less than men, with women of color facing an even bigger gap. This isn't just holding women back—it's holding America back."
"654990700539285505","Fri Oct 16 12:02:06 +0000 2015","The number of American lives lost to gun violence is more than three times the rate as the next developed country. http://t.co/VxoYBfhgLr"
"655080503599591424","Fri Oct 16 17:58:57 +0000 2015","Brava, Jennifer. It's hard to speak up against inequity and risk being unpopular—but equal pay matters for us all. http://t.co/g29cRkq5ln"
"655107943638134785","Fri Oct 16 19:47:59 +0000 2015","Transgender people deserve respect, safety, and equal treatment everywhere. Good move by @TSA. https://t.co/9ZZV0NV6IW"
"655129548506333184","Fri Oct 16 21:13:50 +0000 2015","Yesterday in San Antonio, three-time mayor of San Antonio Julián Castro announced his support for Hillary. http://t.co/HZKpp103Q1"
"655138965666799616","Fri Oct 16 21:51:15 +0000 2015","On Oct. 16, 1916, Planned Parenthood opened their first health center and changed life for women in America. Here's to the next 99 years. -H"
"655189997901869056","Sat Oct 17 01:14:02 +0000 2015","If you’re a progressive who believes in getting things done, sign up for your free sticker! http://t.co/croZqCscnM http://t.co/PlIyHKMwvY"
"655404042118631424","Sat Oct 17 15:24:35 +0000 2015","We can’t ignore America’s racial inequities. http://t.co/lfcpVSlzp2"
"655489268563996674","Sat Oct 17 21:03:14 +0000 2015","As President, Hillary will take on the epidemic of gun violence—with or without Congress’s help. http://t.co/WCzGOEa3Uy"
"655518952551006208","Sat Oct 17 23:01:11 +0000 2015","Attempting to deny citizenship to immigrants' children born here is wrong—and undermines who we are as a country. http://t.co/UEYjq4cruO -H"
"655841493156925440","Sun Oct 18 20:22:51 +0000 2015","“In 2016, the Latino community is going to play a critical role in electing our next president.” -Julián Castro
https://t.co/vRbKqY7AOV"
"656078402101731328","Mon Oct 19 12:04:15 +0000 2015","Hillary has what it takes to lead America. Watch the new video on her accomplishments as Secretary of State:
https://t.co/NHCzrdNskT"
"656143592239464448","Mon Oct 19 16:23:17 +0000 2015","Carly Fiorina challenged Democrats to name an accomplishment of Hillary’s. Senator @BarbaraBoxer accepted: http://t.co/rvSs9FXtpB"
"656199705169268736","Mon Oct 19 20:06:15 +0000 2015","""I don't think I have ever met someone more prepared to be president."" —@Madeleine Albright
https://t.co/D6nCGEDC6v"
"656234361038045184","Mon Oct 19 22:23:58 +0000 2015","The world is a better place because Hillary was Secretary of State. Here’s why: https://t.co/zUEcuPNekw https://t.co/2VIbnulOD7"
"656473549184479233","Tue Oct 20 14:14:25 +0000 2015","Former Senior Advisor to President Obama @davidaxelrod on Hillary's greatest accomplishments as Secretary of State: https://t.co/1yaBsfZkUG"
"656532258300411904","Tue Oct 20 18:07:42 +0000 2015","Hillary has the experience, skills, and vision we need in our next Commander-in-chief. Just ask @madeleine: https://t.co/2ETq3t5GBv"
"656557196361072640","Tue Oct 20 19:46:48 +0000 2015","Before Hillary was running for president, Republicans had the nicest things to say about her. https://t.co/uRr2doIX4K"
"656625716553879552","Wed Oct 21 00:19:04 +0000 2015","“She was able to restore the credibility of the United States.” —Leon Panetta
https://t.co/IPgeqEd48A"
"656648875734794240","Wed Oct 21 01:51:06 +0000 2015","It’s good for our economy when companies prosper by innovating, creating new products, and investing in workers. https://t.co/karaoU0Zmx"
"656661696082153473","Wed Oct 21 02:42:03 +0000 2015","What did Hillary accomplish as Secretary of State? @SenSchumer weighs in: https://t.co/QYIq2iHAtk"
"656810009943105536","Wed Oct 21 12:31:23 +0000 2015","As Secretary of State, Hillary prioritized the education of women &amp; girls to build peaceful and prosperous nations.
https://t.co/VMXkFLVGOe"
"656861386023170048","Wed Oct 21 15:55:32 +0000 2015","Hillary is a longtime fighter for reproductive rights, education, and equal pay. https://t.co/hUO0zHHlur"
"656882880044371968","Wed Oct 21 17:20:57 +0000 2015",".@VP is a good friend and a great man. Today and always, inspired by his optimism and commitment to change the world for the better. -H"
"656933279635865600","Wed Oct 21 20:41:13 +0000 2015","Hillary championed LGBT equality around the world: “The strongest defense ever in terms of gay rights.”
https://t.co/R03iFA5MrB"
