"344132945122054144","Mon Jun 10 16:44:22 +0000 2013","Thanks for the inspiration @ASmith83 &amp; @Sllambe - I'll take it from here... #tweetsfromhillary"
"345175686820012034","Thu Jun 13 13:47:51 +0000 2013","What an incredible Twitter welcome! In my hometown Chicago for #CGIAmerica. 11amET I'll talk about my #BHCCF work http://t.co/YALcy54VIi"
"345581573556535297","Fri Jun 14 16:40:42 +0000 2013",".@2SmalltoFail is my new effort w/ @nextgen_usa to help our kids in their crucial early years. We can all act: http://t.co/dncy8cDgwk"
"345624650186891264","Fri Jun 14 19:31:52 +0000 2013","Having so much fun with Chelsea, taking selfies back stage. MT:@ChelseaClinton http://t.co/QXvdrgDH7n"
"349633984256417794","Tue Jun 25 21:03:32 +0000 2013","Bill, Cheslea &amp; I have sent our love and prayers to our great friend, Madiba, his family and his nation during this difficult time."
"349676416088014848","Tue Jun 25 23:52:08 +0000 2013","I am disappointed in today's decision striking at the heart of the Voting Rights Act. http://t.co/pmxXHO2N7h"
"349970816122892289","Wed Jun 26 19:21:59 +0000 2013","I applaud all the hard work of everyone who worked so tirelessly to make today possible. http://t.co/wP9GWajguy"
"354951219988537347","Wed Jul 10 13:12:20 +0000 2013",".@WPSProject at Bryn Mawr was so inspiring. Women in public sector jobs: 50% by 2050. That's the goal. http://t.co/8xp0ggoKT8"
"355801960554840065","Fri Jul 12 21:32:52 +0000 2013","Malala today at the UN: “Nothing changed in my life except this-weakness, fear and hopelessness died.” Extraordinary young woman. #MalalaDay"
"357336749472612352","Wed Jul 17 03:11:34 +0000 2013","Went to Central Pk Zoo to meet w/wildlife experts about elephants. Their solution: Stop the Killing - Stop the Trafficking - Stop the Demand"
"358006740077391872","Thu Jul 18 23:33:52 +0000 2013","Today I’m reminded of Invictus, a poem Mandela used to recite in prison. You're truly an ""unconquerable soul"" Madiba. Happy 95th Birthday."
"358363269603409920","Fri Jul 19 23:10:36 +0000 2013","Seneca Falls, 165 years ago today, began a movement that remains the unfinished business of the 21st century. http://t.co/zCSbjVvMyI"
"359659535008415745","Tue Jul 23 13:01:29 +0000 2013","Congratulations from across the pond to the Duke and Duchess! Wishing you the best of luck and a bit of advice: It Takes a (Royal) Village!"
"365871110866206720","Fri Aug 09 16:24:05 +0000 2013","Bill &amp; Chelsea are back from a great BH&amp;CCF trip to Africa, just in time for Bill's big news from POTUS: http://t.co/6GFSaiVhhj"
"368075557881524224","Thu Aug 15 18:23:46 +0000 2013",".@RachaelRad, tweet and ye shall receive.  And I see that you're a fellow Downton Abbey fan.  Birds of a feather it would seem!"
"368476115687337984","Fri Aug 16 20:55:26 +0000 2013","Bill wrote a wonderful letter about BHCCF work. So proud of what's been accomplished, I know the best is yet to come. http://t.co/wDsX86zd4n"
"369605784981995520","Mon Aug 19 23:44:20 +0000 2013","I can't believe he turned 67 today.  He doesn't look a day over four... http://t.co/neOvrB7TR6"
"374645764867125248","Mon Sep 02 21:31:25 +0000 2013","Flying to 112 countries is a lot until you consider swimming between 2. Feels like I swim with sharks - but you actually did it! Congrats!"
"378503612399644673","Fri Sep 13 13:01:08 +0000 2013",".@jk_rowling, look familiar? Not Hogwarts but beautiful St Andrews! Thanks to grad student Claire for the grand tour http://t.co/cuOxYry7yt"
"380388878823071744","Wed Sep 18 17:52:30 +0000 2013","Great 1st meeting with @2SmallToFail Leadership &amp; Advisory Council yesterday. Here's some good reading on the issue: http://t.co/ybA33ew9Jr"
"382132379155845121","Mon Sep 23 13:20:33 +0000 2013","Something I didn't know until I read her new bio this AM: Secretary Albright plays the drums. Welcome to Twitter @Madeleine. See you at CGI!"
"383202017478717440","Thu Sep 26 12:10:55 +0000 2013","So proud of what we've done and so much more to do. Join me. #Beijing+20"
"383359574155485185","Thu Sep 26 22:36:59 +0000 2013","8 African nations, 16 NGOs, $80 million, and a path to end elephant poaching. @ChelseaClinton and I are thrilled! http://t.co/zkPNF1EDTc"
"384861493143306240","Tue Oct 01 02:05:05 +0000 2013","Here at #CDF40. My advocacy for children began with Marian Wright Edelman, it continues w/ @2SmallToFail http://t.co/XNIHtHTfUV"
"386101512742912000","Fri Oct 04 12:12:28 +0000 2013","As a mom, I made reading to @ChelseaClinton a priority every night. New studies show us the importance of words: http://t.co/eQftZBVnKz"
"388649942492774400","Fri Oct 11 12:59:01 +0000 2013","New profile pic in honor of the International #DayoftheGirl. Join us at the Clinton Foundation in celebrating. http://t.co/QfhKWkng7E"
"388775900097290240","Fri Oct 11 21:19:32 +0000 2013","@WilliamJHague great seeing you today. I'm so pleased that our special relationship continues even after leaving office."
"393887319088189440","Fri Oct 25 23:50:29 +0000 2013",".@wef report on women shows progress in 2/3 of countries, still more to do. I'll address on Nov 1 in Philadelphia. http://t.co/XBfEQ3L2xD"
"396334924778975232","Fri Nov 01 17:56:24 +0000 2013","No Ceilings: The Full Participation Project. Our new BHCCF initiative to accelerate progress for all women and girls. http://t.co/jzaiKiBTVR"
"399285646172229633","Sat Nov 09 21:21:31 +0000 2013","Talking about how we can empower the next generation in LA with
@ChelseaClinton @2SmallToFail &amp; @ServiceNation http://t.co/RYROq1Z8hp"
"400134441022267392","Tue Nov 12 05:34:19 +0000 2013","Backstage with @GabbyGiffords at the Glamour Women of the Year Awards.  What an incredible woman. http://t.co/edjNP4zXo6"
"400320098059444224","Tue Nov 12 17:52:03 +0000 2013","Text AID to 80108 to give $10 to the @mGiveFoundation to help with Typhoon Haiyan disaster relief effort. I'm doing it, I hope you will too!"
"400831807786348545","Thu Nov 14 03:45:24 +0000 2013","Went to premiere of White Gold @MuseumModernArt last night, a film I narrated about elephant poaching. Coming soon! http://t.co/gCtuWJYepR"
"401052413504663552","Thu Nov 14 18:22:01 +0000 2013","New op ed by Senator, Doctor and friend Bill Frist, who is on the @2SmallToFail leadership council. Worth a read. http://t.co/4MWAy2vbIY"
"401538806668460032","Sat Nov 16 02:34:46 +0000 2013","#SecStates 67 &amp; 68 reunited @giwps today. Watching program backstage before going out to discuss #AfghanWomen. http://t.co/KG05g1aAd4"
"401541001417728000","Sat Nov 16 02:43:29 +0000 2013","After #SecState Kerry spoke, I sat down for Q&amp;A with @laurawbush, my fellow #AfghanWomen Council co-chair. http://t.co/kGbtECg2MN"
"405060412585959424","Mon Nov 25 19:48:22 +0000 2013","Great op ed from another @2SmallToFail leadership council member (and a teacher), @cindymccain . Read it here: http://t.co/6RXwUEbSCQ"
"408772884283555841","Fri Dec 06 01:40:24 +0000 2013","Nelson Mandela was a champion for justice &amp; human dignity, with unmatched grace. I'll remember him as Madiba, truly an unconquerable soul."
"410767329698381825","Wed Dec 11 13:45:37 +0000 2013","On my way back to the U.S. from Madiba's funeral and watching what's going on in Ukraine with alarm."
"410884668607959040","Wed Dec 11 21:31:53 +0000 2013","Just landed in NY. The Ukrainian government must follow Madiba's example &amp; choose dialogue with its people, not force."
"410969065935867904","Thu Dec 12 03:07:15 +0000 2013","Wishing my good friend the 68th #SecState a Very Happy 70th Birthday."
"413004018429198336","Tue Dec 17 17:53:25 +0000 2013","What happens to kids in families cut from unemployment insurance &amp; food stamps? They’re #2SmallToFail, &amp; deserve an equal chance to succeed."
"413392482039103488","Wed Dec 18 19:37:02 +0000 2013","Excited to report Patti Miller (formerly of @sesamestreet) has joined @ClintonFdn to co-lead my early childhood initiative, @2SmallToFail."
"415513805762727937","Tue Dec 24 16:06:25 +0000 2013","Merry XMas &amp; Happy New Year x 1,002,958. Thinking about the millions who face challenges everyday. Looking forward to 2014. So much to do."
"418117050003779584","Tue Dec 31 20:30:47 +0000 2013","10 years ago I was proud to begin working on bipartisan efforts to save unemployment insurance. Let's do it again quickly in this new year."
"418537970854273024","Thu Jan 02 00:23:22 +0000 2014","So pleased &amp; proud to see Mayor @BilldeBlasio sworn in today. MT @BillClinton: What a great day for NYC! http://t.co/VLYwpbIw5M"
"423988521502658560","Fri Jan 17 01:21:55 +0000 2014","1 in 3 women live at or on the brink of poverty in the US. 28 million children depend on them. @ShriverReport @amprog http://t.co/DfteFsNe18"
"425477910871281664","Tue Jan 21 04:00:13 +0000 2014","As a teenager I saw #MLK speak in Chicago &amp; shook his hand. He urged us to stay engaged with the cause of justice. As vital as ever today."
"430154695860953088","Mon Feb 03 01:44:06 +0000 2014","It’s so much more fun to watch FOX when it’s someone else being blitzed &amp; sacked! #SuperBowl"
"430921320193601536","Wed Feb 05 04:30:23 +0000 2014","Join me, @2SmallToFail, &amp; @UniContigo to help close the word gap. Take the pledge: http://t.co/uSPyCJCzYN http://t.co/jzf2KNbnxz"
"433622123865600002","Wed Feb 12 15:22:25 +0000 2014","Briefed by my old @WhiteHouse colleagues yesterday on the new wildlife trafficking report. Good progress being made. http://t.co/N5IOpQY1SA"
"433956902297276417","Thu Feb 13 13:32:42 +0000 2014","Headed in from Chappaqua on this snowy morning to talk to @melindagates about why data is so important for women and girls.  #NoCeilings"
"434444776289873920","Fri Feb 14 21:51:20 +0000 2014","@billclinton all you needed was a good pair of snow boots! But you can watch the event here: http://t.co/7Fmq5R5W8z #NoCeilings"
"438511699134795776","Wed Feb 26 03:11:50 +0000 2014","Some of the team from Beijing '95 who declared women's rights are human rights. Great reunion today, more work to do. http://t.co/aMfaWKyRCp"
"439077420495544321","Thu Feb 27 16:39:49 +0000 2014","Some encouraging news today from China's business leaders on stopping the demand for ivory. http://t.co/Ink67HiRt8"
"442340371188568064","Sat Mar 08 16:45:37 +0000 2014","For #IWD2014, I celebrate the work of Eleanor Roosevelt, a courageous advocate for human rights. Her work continues to inspire. #NoCeilings"
"442426026371870720","Sat Mar 08 22:25:59 +0000 2014",".@UN SecGen Ban Ki-moon @phumzileunwomen great to see you for @UN_Women yesterday. Watch here: http://t.co/8uh9uPfF8m http://t.co/cxrVHj2DQH"
"447233637054820352","Sat Mar 22 04:49:42 +0000 2014","The freedom to speak out &amp; to connect is a fundamental right. The people of Turkey deserve that right restored. #TwitterisblockedinTurkey"
"447435839551713280","Sat Mar 22 18:13:11 +0000 2014","Great to be back in Arizona with @SenJohnMcCain &amp; @cindymccain at #CGIU. Looking forward to the weekend @ASU. http://t.co/H8q8Im6FUQ"
"447592667845627904","Sun Mar 23 04:36:22 +0000 2014","Today @CGIU MT @jimmykimmel: @TheEllenShow- 3 Clintons &amp; a Kimmel @BillClinton @ChelseaClinton #selfie http://t.co/YsJP8iNqCj"
"448259775302610944","Tue Mar 25 00:47:13 +0000 2014",".@tulsaeducare @GKFF @2SmallToFail Great day launching #TalkingIsTeachingTulsa.  And, I made some new friends: http://t.co/bX7OmEofSO"
"451047120267919360","Tue Apr 01 17:23:08 +0000 2014","Well, that explains what happened to my iPad! RT @BillClinton: I'm following my leader! http://t.co/uxRSkP9yNl"
"451501362464190464","Wed Apr 02 23:28:07 +0000 2014","A majority of lower wage jobs are held by women. Raising the minimum wage is good for women &amp; for the economy. http://t.co/7UgMrmMIad"
"452130729691201536","Fri Apr 04 17:09:00 +0000 2014","Great to meet the strong &amp; brave young women from #PussyRiot, who refuse to let their voices be silenced in #Russia. http://t.co/7JVkZ9TYx3"
"453688842621431808","Wed Apr 09 00:20:23 +0000 2014","20 years ago, women made 72 cents on the dollar to men. Today it's still just 77 cents. More work to do.  #EqualPay #NoCeilings"
"454801510065786880","Sat Apr 12 02:01:44 +0000 2014","Good luck to my friend &amp; former colleague Deputy Secretary Bill Burns. A treasure of American diplomacy. http://t.co/TBa4UsYl7Z"
"456903198834700288","Thu Apr 17 21:13:06 +0000 2014","My most exciting title yet: Grandmother-To-Be! @billclinton and I are thrilled that Chelsea and Marc are expecting their first child!"
"461119435244572672","Tue Apr 29 12:26:55 +0000 2014","My heart is with all those in Arkansas and elsewhere that were in the path of those terrible tornados."
"462986339378814977","Sun May 04 16:05:19 +0000 2014","Access to education is a basic right &amp; an unconscionable reason to target innocent girls. We must stand up to terrorism. #BringBackOurGirls"
"465601750431322113","Sun May 11 21:18:02 +0000 2014",".@voguemagazine Thank you Anna. Wishing all the mothers out there a Happy Mother's Day, &amp; looking forward to celebrating a new mother soon."
"467479562172248064","Sat May 17 01:39:47 +0000 2014","In Little Rock today with Dale and Leslie Chihuly for the opening of his spectacular new exhibit @ClintonCenter. http://t.co/b4KIP3IaQf"
"470220916375707648","Sat May 24 15:12:57 +0000 2014","Happy 90th Birthday to my former colleagues in the Foreign Service!  It was an honor to spend 4 years working with you. #FS90"
"470325803482619904","Sat May 24 22:09:44 +0000 2014","Meriam Yahya Ibrahim’s death sentence is abhorrent. Sudan should stop threatening religious freedom and fundamental human rights."
"471986886601605121","Thu May 29 12:10:17 +0000 2014","I will miss my friend #MayaAngelou. Truly a #PhenomenalWoman."
"472169933200048128","Fri May 30 00:17:39 +0000 2014","I came across this photo this morning and saw others sharing it, thought I would too. #MayaAngelou http://t.co/MVDuSDpAdN"
"473509138928922624","Mon Jun 02 16:59:10 +0000 2014","At the @ClintonFdn we say, “We’re all in this together."" Read Charles Blow’s NYT column this morning. #YesAllOfUs 
http://t.co/tmWhxR2SfU"
"480822509822959616","Sun Jun 22 21:19:54 +0000 2014",".@katyperry Well that’s not a Hard Choice. You already did! Keep letting us hear you Roar."
"481052866610593794","Mon Jun 23 12:35:15 +0000 2014","National paid family leave benefits families &amp; our economy. Get the facts: http://t.co/FKkV4eAW6m. And visit http://t.co/Q2zgOMzqdQ"
"482269553766854657","Thu Jun 26 21:09:56 +0000 2014",".@2SmallToFail &amp; our kids have a big advocate in the @WhiteHouse, reminding parents &amp; caregivers #TalkingisTeaching http://t.co/iPBGDBY1GX"
"482377124431421441","Fri Jun 27 04:17:23 +0000 2014","Heartbreaking news: a vital voice for justice is silenced. http://t.co/FtUdjTnSiR"
"483755538589556736","Mon Jun 30 23:34:42 +0000 2014","Hard-working women will pay the price for today's two troubling #SCOTUS decisions -- in wages, health care &amp; dignity."
"484295213209620480","Wed Jul 02 11:19:11 +0000 2014","Stopped by @HudsonBooks at JFK before my flight to London.  We're taking the #HardChoices book tour across the pond! http://t.co/0xjk8DEmp5"
"485152297170001921","Fri Jul 04 20:04:56 +0000 2014",".@2SmallToFail &amp; @EssenceMag team up to close the word gap &amp; help parents talk, read &amp; sing to kids. More here:   http://t.co/Loc7gxoPHk"
"490136058818883584","Fri Jul 18 14:08:37 +0000 2014","So great to see @billclinton taking #NoCeilings on the road to India to talk about women in the economy. http://t.co/EAit4Yaxxe"
"491307658305994752","Mon Jul 21 19:44:08 +0000 2014","In #SiliconValley today visiting @Google, @Facebook, &amp; @Twitter.  Looking forward to seeing everyone and answering some questions."
"491311768648417282","Mon Jul 21 20:00:28 +0000 2014","After a year of #TweetsFromHillary, I want to hear from you. At 5:20pm PT, I'll be at @Twitter doing a Q&amp;A on #HardChoices. #AskHillary"
"491364575392964608","Mon Jul 21 23:30:18 +0000 2014","On my way to @Twitter! Tweet your questions to me with #AskHillary &amp; watch my conversation with @KatieS here: http://t.co/RBLJKyLk24"
"491989336250798080","Wed Jul 23 16:52:53 +0000 2014","On my way to Oakland and excited to announce a new @2smalltofail campaign there. #LetsTalkOakland"
"493081150202847233","Sat Jul 26 17:11:21 +0000 2014","Come On Oakland, Let's Do This - a great rallying cry from @urbanstratoak on why talking, reading, &amp; singing matters. http://t.co/XUd3AneFGQ"
"497095699197333504","Wed Aug 06 19:03:44 +0000 2014","For #IReadEverywhere w/ @NYPL, I'm reminded of moments reading to Chelsea when she was little. Let's #closethewordgap http://t.co/7vMK91D1J8"
"501735800279941120","Tue Aug 19 14:21:51 +0000 2014","A very Happy Birthday to my very wonderful husband today. 
http://t.co/LwygmFj3FP"
"507526916447150080","Thu Sep 04 13:53:40 +0000 2014","I’ve broken bread w/ all of my fellow #SecStates but we’ve never broken ground! Great visit to @StateDept yesterday. http://t.co/I4VH9aSX7r"
"511489834440228864","Mon Sep 15 12:20:54 +0000 2014","Congratulations California on winning #PaidSickDays, which will help 6.5 million workers. #WeAllGetSick http://t.co/7P4SPKdGpi"
"514556684325650432","Tue Sep 23 23:27:28 +0000 2014","Proud to announce 3 more #JobOne commitments at #CGI to create more job pathways for youth- Join us at http://t.co/ISwCKp5L1S @ClintonGlobal"
"514917530478317568","Wed Sep 24 23:21:20 +0000 2014","#GirlsCHARGE commits to help 15 million girls get access to secondary school. #NoCeilings #CGI2014 #SmartThingToDo http://t.co/fPAqMyeb2G"
"515946897396469761","Sat Sep 27 19:31:40 +0000 2014",".@BillClinton and I are over the moon to be grandparents! One of the happiest moments of our life. http://t.co/Cww4r8C9Zt"
"518142267291631616","Fri Oct 03 20:55:17 +0000 2014","Kathryn Bigelow's new short LAST DAYS makes the case for why poaching &amp; terrorism are connected, &amp; why it matters. http://t.co/P8gcD0QcDn"
"518449653638234115","Sat Oct 04 17:16:44 +0000 2014","Hopeful to see NYC lead the way in raising wages for working families. Thanks Mr. Mayor.  http://t.co/krqBHSbWgi"
"519919196986425344","Wed Oct 08 18:36:10 +0000 2014","Love these innovative investments to close the #wordgap &amp; opportunity gap for Chicago kids cc @2SmallToFail 
http://t.co/40zJamDJLy"
"520643622409367552","Fri Oct 10 18:34:47 +0000 2014","Congratulations to Malala Yousafzai and Kailash Satyarthi, tireless champions for the education and freedom of every girl and boy."
"521446005544615936","Sun Oct 12 23:43:10 +0000 2014","Proud to launch a new toolkit at #AAP14 to help pediatricians &amp; parents talk, read &amp; sing to babies: http://t.co/E2yKvRUYGX @2SmallToFail"
"525994975788797952","Sat Oct 25 12:59:09 +0000 2014","New @oppnation data shows encouraging news on youth employment, but so much more to do. Read more about #JobOne here: http://t.co/8LSjh9ik3d"
"532301376907644929","Tue Nov 11 22:38:32 +0000 2014","Thinking of my dad today, and all of the others who served before and after him. #VeteransDay http://t.co/PegPl68PEU"
"535528506877575169","Thu Nov 20 20:22:00 +0000 2014","In Memphis @StJude children's hospital to dedicate the Marlo Thomas Center and see their new proton therapy center. http://t.co/d3BF7uEvwK"
"535560212938518528","Thu Nov 20 22:27:59 +0000 2014","Quality child care makes our families &amp; communities stronger. Thanks to the President for signing bipartisan child care bill. @2SmallToFail"
"535605199705239552","Fri Nov 21 01:26:45 +0000 2014","Thanks to POTUS for taking action on immigration in the face of inaction. Now let’s turn to permanent bipartisan reform. #ImmigrationAction"
"536279302619553794","Sat Nov 22 22:05:23 +0000 2014","Went to @cookstoves summit yesterday w/global &amp; industry leaders focused on a worthy mission. Cooking shouldn't kill. http://t.co/PY24J4KEXD"
"538030705826361344","Thu Nov 27 18:04:51 +0000 2014","Today I'm thankful for the new addition to our family &amp; thinking about little ones everywhere. Happy #Thanksgiving cc: @2SmallToFail"
"539611785540935680","Tue Dec 02 02:47:29 +0000 2014","Let’s join @PEPFAR, @gatesfoundation &amp; @girleffect in fighting for an AIDS-free future for girls. #WAD2014 More here: http://t.co/BPxWWkJr6X"
"541298556574109696","Sat Dec 06 18:30:07 +0000 2014","An important fundraising drive by @WFP: Donate $1, create a lifeline to 1.7M Syrian refugees. #ADollarALifeline https://t.co/wYKLG5z2LE"
"556163273738166272","Fri Jan 16 18:57:12 +0000 2015","Attacking financial reform is risky and wrong. Better for Congress to focus on jobs and wages for middle class families."
"557331318527508480","Tue Jan 20 00:18:35 +0000 2015","What would MLK say today? Great strides but miles to go. We have to keep up the fight against injustice. #MLKDay"
"557739125886169088","Wed Jan 21 03:19:04 +0000 2015","@BarackObama #SOTU pointed way to an economy that works for all. Now we need to step up &amp; deliver for the middle class. #FairShot #FairShare"
"558067419311534080","Thu Jan 22 01:03:35 +0000 2015","Looks like @elmo enjoyed reading with @ChelseaClinton more than when I sang to her as a baby. #tinear @2SmallToFail http://t.co/2F9TgVwFsg"
"558803493809836033","Sat Jan 24 01:48:29 +0000 2015",".@madeleine there must be something in the water @Wellesley. #YouGoGirl"
"559059170213646336","Sat Jan 24 18:44:27 +0000 2015","I'll never forget watching Ernie Banks play- broke barriers, loved baseball &amp; life. We'll miss Mr. Cub. #LetsPlayTwo http://t.co/MKeOeVEYEa"
"562456798020386816","Tue Feb 03 03:45:25 +0000 2015","The science is clear: The earth is round, the sky is blue, and #vaccineswork. Let's protect all our kids. #GrandmothersKnowBest"
"566411457298841600","Sat Feb 14 01:39:49 +0000 2015",".@bfrist &amp; I may not agree on everything, but see why we believe kids' health insurance is a priority. #commonground http://t.co/4fkdQElvVC"
"566663754268831744","Sat Feb 14 18:22:21 +0000 2015","Good week for #Philadelphia...
http://t.co/YqX35enaHP"
"566692386282418176","Sat Feb 14 20:16:08 +0000 2015","@billclinton It's a date!"
"570749660341657600","Thu Feb 26 00:58:17 +0000 2015","Yesterday I met all-star women of tech in Silicon Valley, but #GirlsCanCode anywhere &amp; everywhere. Interesting story: http://t.co/W1ume2CbSS"
"573340998287413248","Thu Mar 05 04:35:20 +0000 2015","I want the public to see my email. I asked State to release them. They said they will review them for release as soon as possible."
"574319994495987712","Sat Mar 07 21:25:31 +0000 2015","Watched @repjohnlewis &amp; @BarackObama in #Selma. Let’s answer their call to keep fighting for voting rights, civil rights, &amp; human rights."
"574621709543870466","Sun Mar 08 17:24:26 +0000 2015","See my new profile pic to raise awareness on how far we've come in reaching equal rights for women &amp; girls worldwide. http://t.co/MzqVBq6FTL"
"575047986356551680","Mon Mar 09 21:38:18 +0000 2015","Excited to share the #NoCeilings data. Hope you will dive in &amp; use it, share it, learn from it, &amp; get motivated: http://t.co/GLCVDR69bC"
"575735894386216960","Wed Mar 11 19:11:48 +0000 2015","GOP letter to Iranian clerics undermines American leadership.  No one considering running for commander-in-chief should be signing on."
"577559904774459392","Mon Mar 16 19:59:46 +0000 2015","Congressional trifecta against women today: 1) Blocking great nominee, 1st African American woman AG, for longer than any AG in 30 years…"
"577560394987921408","Mon Mar 16 20:01:43 +0000 2015","...2) Playing politics with trafficking victims… 3) Threatening women's health &amp; rights."
"577983890889039872","Wed Mar 18 00:04:32 +0000 2015","Budgets reflect our priorities. They should help families get ahead, educate our kids, and spark small business growth."
"577984032857829377","Wed Mar 18 00:05:06 +0000 2015","Our nation's future - jobs &amp; economic growth - depends on investments made today. The GOP budget fails Americans on these principles."
"577984196460855297","Wed Mar 18 00:05:45 +0000 2015","Making college more affordable is an investment in our kids and economic growth. Cuts to Pell Grants hold our kids back."
"577984339243331584","Wed Mar 18 00:06:19 +0000 2015","Repeal of the ACA would let insurers write their own rules again, and wipe out coverage for 16 million Americans."
"580132218166726656","Mon Mar 23 22:21:13 +0000 2015","#ACA@5: 16m covered. Young ppl. Preexisting conditions. Women get better coverage. Repeal those things? Embrace them! http://t.co/OI1m2VxD4W"
"581238635594403840","Thu Mar 26 23:37:44 +0000 2015","Protecting pregnant women from discrimination shouldn't be a fight, should be as American as apple pie. More to do: 
http://t.co/icUxTfuBUz"
"581267449523343360","Fri Mar 27 01:32:14 +0000 2015","Sad this new Indiana law can happen in America today. We shouldn't discriminate against ppl bc of who they love #LGBT http://t.co/mDhpS18oEH"
"581537849054519296","Fri Mar 27 19:26:42 +0000 2015","Loved serving w/ @SenatorReid, true friend, partner, &amp; fighter for the middle class. Big loss for Senate, Nevada &amp; country. #ThanksHarry"
"581644312275992576","Sat Mar 28 02:29:45 +0000 2015","Abusive payday lenders take advantage of families trying to get ahead. Glad to see @BarackObama &amp; @CFPB take a stand. http://t.co/7CALMIwGzi"
"583291187559284736","Wed Apr 01 15:33:50 +0000 2015","Like IN law, AR bill goes beyond protecting religion, would permit unfair discrimination against #LGBT Americans. I urge Governor to veto."
"585235055078940673","Tue Apr 07 00:18:04 +0000 2015","The detention of women's activists in #China must end. This is inexcusable. #FreeBeijing20Five Read this story: http://t.co/qV3VNOgmyG"
"586006768834215936","Thu Apr 09 03:24:35 +0000 2015","Praying for #WalterScott's family. Heartbreaking &amp; too familiar. We can do better - rebuild trust, reform justice system, respect all lives."
