"740964361552941056","Thu Jun 09 17:50:44 +0000 2016","President Obama endorses Hillary: ""I don’t think there’s ever been someone so qualified to hold this office."" https://t.co/KetvKoa853"
"740965834470916097","Thu Jun 09 17:56:36 +0000 2016","Honored to have you with me, @POTUS. I'm fired up and ready to go! -H"
"740972975680290820","Thu Jun 09 18:24:58 +0000 2016","""She’s got the courage, the compassion, and the heart to get the job done.""

Watch President Obama endorse Hillary.
https://t.co/DzKgMFgdmP"
"740973710593654784","Thu Jun 09 18:27:53 +0000 2016","Delete your account. https://t.co/Oa92sncRQY"
"740982988960346112","Thu Jun 09 19:04:46 +0000 2016","""I’m with her, I’m fired up, and I can’t wait to get out there and campaign for Hillary."" —@POTUS https://t.co/ptbhfpCooQ"
"740996208827731968","Thu Jun 09 19:57:17 +0000 2016","""I know how hard this job can be. That’s why I know she’ll be so good at it."" —@POTUS https://t.co/RDjefd0t9f"
"741036783698345988","Thu Jun 09 22:38:31 +0000 2016","""I’ve seen her judgment, toughness, and commitment to our values up close. ... I'm with her."" —@POTUS https://t.co/DzKgMFgdmP"
"741068137773305860","Fri Jun 10 00:43:07 +0000 2016","""When we come together...we won’t just win in November—we’ll build on the progress we’ve made."" —@POTUS https://t.co/WJ8rdqShqx"
"741076353378844672","Fri Jun 10 01:15:45 +0000 2016","“I’m supporting Hillary Clinton because she’s a fighter, a fighter with guts” —@SenWarren  https://t.co/ia0cfYnD3k"
"741077241409511424","Fri Jun 10 01:19:17 +0000 2016","Trump ""doesn’t care who gets hurt as long as he makes a profit off it. That cannot be the person who leads the United States"" —@SenWarren"
"741098335013113856","Fri Jun 10 02:43:06 +0000 2016",".@SenWarren endorsing Hillary on @maddow: ""She's a fighter.""
https://t.co/ppzKyKbCaU"
"741110418807115776","Fri Jun 10 03:31:07 +0000 2016","Thanks, Obama. https://t.co/DzKgMFgdmP"
"741122964813447168","Fri Jun 10 04:20:58 +0000 2016","Proud to have the support of @SenWarren—a woman who is Trump's exact opposite: honest, decent, and deeply concerned for working families. -H"
"741259364657463296","Fri Jun 10 13:22:59 +0000 2016","Thank you, @POTUS. https://t.co/gPFJ4LZq0B"
"741315271655317504","Fri Jun 10 17:05:08 +0000 2016","Ever notice the politicians who oppose birth control and abortion also oppose policies that make it easier to raise a child—like paid leave?"
"741316543800352768","Fri Jun 10 17:10:11 +0000 2016","Laws that restrict access to abortion don’t make women less likely to seek it—they just make women less safe. https://t.co/vj4ZOeHq4V"
"741317714103402496","Fri Jun 10 17:14:50 +0000 2016","Trump has called women “pigs,” “dogs,” and “disgusting animals.”

We can't even count on him to respect women—much less protect our rights."
"741367066385584128","Fri Jun 10 20:30:57 +0000 2016","Thanks, @VP Biden! Your support is a BIG… deal. -H https://t.co/ShRoVUFocR"
"741378346404044800","Fri Jun 10 21:15:46 +0000 2016","Trump can’t say he treats women with respect.

(For once, he’s right.)
https://t.co/eaOpDVA8Bb"
"741409978376957952","Fri Jun 10 23:21:28 +0000 2016","""I am the least racist person that you’ve ever encountered."" —@realDonaldTrump https://t.co/9EvXSWTQGr https://t.co/smaUds8PnY"
"741425791825776640","Sat Jun 11 00:24:18 +0000 2016",".@realDonaldTrump says he’ll be “the best for women.”

Don't think so. https://t.co/zsXgf8wQF2"
"741443616594395137","Sat Jun 11 01:35:08 +0000 2016","A man with this much contempt and disrespect for women has no business becoming president. https://t.co/eaOpDVixJD"
"741694471000072192","Sat Jun 11 18:11:56 +0000 2016","Trump University: Pad Donald's pockets and put your own finances at risk—all for the low price of $35,000!
https://t.co/6NHo9RTyHz"
"741717376845123584","Sat Jun 11 19:42:57 +0000 2016","When Trump goes off his staff's script he insults anyone who challenges him. Judge for his heritage, senator for hers. Rs should disavow. -H"
"741788913476481024","Sun Jun 12 00:27:13 +0000 2016","Donald Trump considers his shuttered casinos a success because HE made millions.

A man who thinks that way has no business being president."
"741983463721553920","Sun Jun 12 13:20:17 +0000 2016","Woke up to hear the devastating news from FL. As we wait for more information, my thoughts are with those affected by this horrific act. -H"
"742068030620962817","Sun Jun 12 18:56:20 +0000 2016","""I join Americans in praying for the victims of the attack in Orlando."" 

Hillary's statement: https://t.co/MmaGjrSufr"
"742070501032534017","Sun Jun 12 19:06:09 +0000 2016","""To the LGBT community: please know that you have millions of allies across our country. I am one of them.” —Hillary https://t.co/MmaGjrSufr"
"742071728118059009","Sun Jun 12 19:11:01 +0000 2016","""We need to keep guns like the ones used last night out of the hands of terrorists or other violent criminals."" —Hillary on the FL attack"
"742072889860579329","Sun Jun 12 19:15:38 +0000 2016","""This is a time to stand together and resolve to do everything we can to defend our communities and country."" —Hillary on the attack in FL"
"742367624089194496","Mon Jun 13 14:46:48 +0000 2016","""We cannot demonize, demagogue, and declare war on an entire religion...Hate is not the answer to hate."" —Hillary"
"742407644284092417","Mon Jun 13 17:25:50 +0000 2016","We need to stop terrorists from getting the weapons they need to carry out attacks. https://t.co/Q6r7VVj9ds"
"742407933108092929","Mon Jun 13 17:26:59 +0000 2016","If the FBI is watching you for suspected terrorist links, you shouldn’t be able to just go buy a gun with no questions asked."
"742408690985226241","Mon Jun 13 17:29:59 +0000 2016","Background checks and an assault weapons ban might not stop every attack—but they'll stop some, and save lives. We need to fight for them."
"742409362593964032","Mon Jun 13 17:32:39 +0000 2016","Inflammatory anti-Muslim rhetoric hurts the vast majority of Muslims who love freedom and hate terror. It’s wrong, and it's dangerous."
"742409706359119872","Mon Jun 13 17:34:01 +0000 2016","The terrorist in Orlando targeted LGBT Americans out of hatred and bigotry. 

An attack on any American is an attack on all Americans."
"742410092457406464","Mon Jun 13 17:35:34 +0000 2016","""To all the LGBT people grieving today: you have millions of allies who will always have your back. I am one of them."" —Hillary"
"742426734188990464","Mon Jun 13 18:41:41 +0000 2016","We have to stand together and be proud together. There is no better rebuke to the terrorists and all those who hate. https://t.co/jnFMG6J5Ac"
"742443337840484352","Mon Jun 13 19:47:40 +0000 2016","Our diversity isn’t a liability in the fight against terrorism. It’s an asset. It makes us stronger. https://t.co/0cTpmfvA3c"
"742482739257958400","Mon Jun 13 22:24:14 +0000 2016","Weapons of war like those used in Orlando and San Bernardino have no place on our streets.
https://t.co/jTFExpjcPd"
"742688472960471041","Tue Jun 14 12:01:45 +0000 2016","If you’re too dangerous to get on a plane, you're too dangerous to buy a gun in America. https://t.co/jTFExp1BXF"
"742734905306681344","Tue Jun 14 15:06:15 +0000 2016","Gun violence prevention laws might not stop every shooting or terrorist attack—but they will save lives. https://t.co/raNqMJ4ez8"
"742756232411418624","Tue Jun 14 16:31:00 +0000 2016","People of different faiths, backgrounds, sexual orientations, and gender identities are coming together to say: we won’t let hate defeat us."
"742757215333928961","Tue Jun 14 16:34:54 +0000 2016","Americans don’t need conspiracy theories and pathological self-congratulations. We need leadership, common sense, and concrete plans."
"742758405845176320","Tue Jun 14 16:39:38 +0000 2016","Trump's Muslim ban is wrong, dangerous, and in this instance, nonsensical. The terrorist in Orlando was born in Queens—just like Donald."
"742758741305614336","Tue Jun 14 16:40:58 +0000 2016","Trump's statements are lies—but he tells them because he has to distract from the fact that he has nothing substantive to say for himself."
"742759450860257280","Tue Jun 14 16:43:47 +0000 2016","People can’t board planes with full shampoo bottles—but people being watched by the FBI for terrorism can buy a gun, no questions asked?"
"742760897853198336","Tue Jun 14 16:49:32 +0000 2016","This is one nation under God, indivisible, with liberty and justice for all. Not just for those who look or love or worship one way—for all."
"742883216105803781","Wed Jun 15 00:55:35 +0000 2016","We just won Washington, D.C.! Grateful to everyone who voted. https://t.co/ImPsK42yGd"
"742905381744218114","Wed Jun 15 02:23:40 +0000 2016","Donald Trump just gave us his ""plan"" for defeating terrorism—conspiracy theories and self-congratulations. https://t.co/5tgNsWkoQh"
"742917897400557573","Wed Jun 15 03:13:24 +0000 2016","America has always been a country of ""we,"" not ""me."" And we've always been stronger together. https://t.co/hInlN74PFR"
"743080427569741824","Wed Jun 15 13:59:14 +0000 2016","Donald Trump is an expert at distracting people from the fact that he has nothing substantive to say for himself. https://t.co/1ZHvalDS3R"
"743123070693449728","Wed Jun 15 16:48:41 +0000 2016","Your @GOP presidential nominee responding to a terrorist attack with lies and conspiracy theories.
https://t.co/TZJmXefmx4"
"743157530780655616","Wed Jun 15 19:05:37 +0000 2016","Some fights are too important to stay silent. Preventing gun violence is one of them. Stand strong @ChrisMurphyCT. https://t.co/LEl7iSLCgF"
"743230014833954816","Wed Jun 15 23:53:38 +0000 2016","Thank you, @SenWarren. Proud to be in this fight with you. https://t.co/2bbZ70Pidx"
"743273251036553217","Thu Jun 16 02:45:27 +0000 2016","Belgium: Donald Trump's favorite ""city.""
https://t.co/9ASLMhAbiF"
"743459396982812672","Thu Jun 16 15:05:07 +0000 2016","It's absurd that people with suspected terrorist links can buy a gun in America, no questions asked. https://t.co/y0yVjO1k1K"
"743464285972533249","Thu Jun 16 15:24:33 +0000 2016","One year ago today, @realDonaldTrump announced his campaign for president.

And what a year it's been.
https://t.co/fYf3Ke7srE"
"743533823648894976","Thu Jun 16 20:00:52 +0000 2016","Hillary helped get health care for 8 million kids. One of the first ads of the general election:
https://t.co/bkKDfo2gsA"
"743547818011394048","Thu Jun 16 20:56:28 +0000 2016","Thanks Chris, for showing what leadership looks like. I hope GOP senators take note. Looking forward to the vote. -H https://t.co/ookEqS1HMd"
"743556345606057985","Thu Jun 16 21:30:22 +0000 2016",".@oprah Thank you. It’s an honor to have the support of someone who's shattered so many glass ceilings. https://t.co/U34EtHoYQD"
"743567954739142656","Thu Jun 16 22:16:29 +0000 2016","Thank you, @SpencerJCox. Despite our differences, if we stand together, hate can never defeat us. https://t.co/3o9wyU1Ref"
"743583729138995200","Thu Jun 16 23:19:10 +0000 2016","""It is cruel and terrible that her life was cut short by a violent act of political intolerance"" —Hillary on Jo Cox: https://t.co/FUShBg11it"
"743627214923632644","Fri Jun 17 02:11:58 +0000 2016","Hi. https://t.co/11Fyyf5IQm"
"743637734904958978","Fri Jun 17 02:53:46 +0000 2016","Hard to believe it's only been a year since Trump announced his candidacy for president. https://t.co/fYf3Kep3Qe"
"743785125918420992","Fri Jun 17 12:39:27 +0000 2016","Helpful. https://t.co/zB9dY1Of3P"
"743804793420910592","Fri Jun 17 13:57:36 +0000 2016","Trump has made a big show of supposedly supporting veterans. In reality, he's done the exact opposite. https://t.co/LipYR4dYxI"
"743842950912737281","Fri Jun 17 16:29:14 +0000 2016","Donald Trump says he's ""the real friend"" of the LGBT community.

Yeah, no.
https://t.co/TWwZKC5ARS"
"743869620159909888","Fri Jun 17 18:15:12 +0000 2016","You don't have to be LGBT to stand with the LGBT community. We all have a stake in equality. Thank you, Michael. https://t.co/EfEMVugWCp"
"743875582333751296","Fri Jun 17 18:38:54 +0000 2016","One year ago we lost 9 lives in Charleston. 49 in Orlando on Sunday. 26 in Newtown. Too many others. This has to stop. We need to change. -H"
"743897609186742272","Fri Jun 17 20:06:25 +0000 2016","We can't stop fighting until every LGBT American can live life freely, openly, and without fear. https://t.co/9XaF4l4n21"
"743959844315602945","Sat Jun 18 00:13:43 +0000 2016","Gun violence and hate aren't isolated—homophobia in Orlando, racism in Charleston. We need to fight them together. https://t.co/HcBJzknBz7"
"744163071074140161","Sat Jun 18 13:41:16 +0000 2016","On June 18, 1983, Sally Ride became the first American woman and first LGBT astronaut to go to space. https://t.co/tT08U2WiiW"
"744193553375498241","Sat Jun 18 15:42:24 +0000 2016","If your business or organization is hiring and needs someone to get the job done, hire a veteran.
https://t.co/sKlNiCFtMM"
"744532685998161920","Sun Jun 19 14:09:59 +0000 2016","Happy Father's Day, @BillClinton! https://t.co/3C2RFFuIAr"
"744629982757064705","Sun Jun 19 20:36:37 +0000 2016","What a joy being with our new grandson, Aidan. So grateful. -H https://t.co/0687tOERez"
"744714049779171328","Mon Jun 20 02:10:40 +0000 2016","Gay rights are human rights and human rights are gay rights. Being LGBT does not make you less human.
https://t.co/JkWZto9fz9"
"744876285730627584","Mon Jun 20 12:55:20 +0000 2016","Happy first day of summer. https://t.co/yfuIRFr6mG"
"744988038493769728","Mon Jun 20 20:19:24 +0000 2016","This is just common sense. It's time for Congress to act. https://t.co/SsJuC4D7Pm"
"744994276413628416","Mon Jun 20 20:44:11 +0000 2016","Tonight, the Senate will vote on commonsense measures to prevent gun violence. Tell your senators you support them: https://t.co/ukrcuor0YJ"
"745005438991728640","Mon Jun 20 21:28:32 +0000 2016","America has always been a nation of immigrants and refugees. On #WorldRefugeeDay, let's reaffirm our commitment to welcoming them. -H"
"745050210372575234","Tue Jun 21 00:26:27 +0000 2016","An overwhelming majority of Americans (and gun owners) support steps to reduce gun violence.

RT if you're one of them. #DisarmHate"
"745054252171726848","Tue Jun 21 00:42:30 +0000 2016","Enough. -H https://t.co/3herO6i1Pr"
"745063650193457152","Tue Jun 21 01:19:51 +0000 2016","It’s time to demand more than thoughts and prayers from our elected officials. https://t.co/LGl3QkhGAI #DisarmHate https://t.co/ehqCXheGqP"
"745084680865726465","Tue Jun 21 02:43:25 +0000 2016",".@JoeBiden is right—Donald Trump’s worldview doesn't reflect our values, and it’s not who we are. https://t.co/k6F440uf8t"
"745239426872205312","Tue Jun 21 12:58:19 +0000 2016","Trump's gotten rich driving companies into the ground. What will he do to the U.S. economy?

Oh wait—we know:
https://t.co/MOPrGekYtZ"
"745255665237655553","Tue Jun 21 14:02:51 +0000 2016","""Trump's economic proposals could produce a prolonged recession...and reduce employment by 3.5 million jobs."" —@WSJ https://t.co/MOPrGeCzSz"
"745271373363290113","Tue Jun 21 15:05:16 +0000 2016","What is Trump spending his meager campaign resources on? Why, himself, of course. https://t.co/6LsNwf4gTL"
"745291887448363008","Tue Jun 21 16:26:47 +0000 2016",".@TheEconomist declared Donald Trump one of the 10 biggest threats to the global economy. https://t.co/66kTxlywHU https://t.co/He9Xl3zsRO"
"745292264835014656","Tue Jun 21 16:28:17 +0000 2016","Donald Trump is proud of his recklessness—that’s his business. But when he’s running for president, it’s ours."
"745292954626048000","Tue Jun 21 16:31:01 +0000 2016","""He says women will start making equal pay as soon as they do as good a job as men—as if we aren’t already."" —Hillary on @realDonaldTrump"
"745293890798903298","Tue Jun 21 16:34:45 +0000 2016","""President Trump"" would undo so much of the progress we’ve made over the past 8 years under President Obama.

We can't let that happen."
"745298244192862209","Tue Jun 21 16:52:03 +0000 2016",".@realDonaldTrump, only someone who’s never actually faced the consequences of his mistakes would brag, “I play with bankruptcy.”"
"745299197600145408","Tue Jun 21 16:55:50 +0000 2016","In America, we don’t begrudge people being successful – but we know they shouldn’t do it by destroying other people. https://t.co/lQ1IzXFZrV"
"745337568615555073","Tue Jun 21 19:28:18 +0000 2016",".@realDonaldTrump has written a lot of books about business, but they all seem to end at Chapter 11.
https://t.co/LU8aCjFm2J"
"745361708189782016","Tue Jun 21 21:04:14 +0000 2016","Trump's plan would cut more taxes for the 120,000 richest families than it would for 120 million working Americans.
https://t.co/wiIOTQmj6r"
"745421602565820416","Wed Jun 22 01:02:13 +0000 2016","Trump says, “I love playing with debt.” Someone should tell him our economy isn’t a game. https://t.co/CoTyTjMvS6"
"745452309698613248","Wed Jun 22 03:04:15 +0000 2016","""Trump's economic plans would destroy the U.S. economy."" —@TheAtlantic
https://t.co/mT42WLYl1H"
"745588079600218112","Wed Jun 22 12:03:45 +0000 2016","FACT: No major company has filed for Chapter 11 more often in the last 30 years than @realDonaldTrump's casinos. https://t.co/t4n55HQuII"
"745647857345101824","Wed Jun 22 16:01:17 +0000 2016","This is what real leadership looks like. https://t.co/4Nh6QpqSxL"
"745688969023791104","Wed Jun 22 18:44:39 +0000 2016","“The heart of my plan will be the biggest investment in American infrastructure in decades.” —Hillary https://t.co/R6Tw2HzMhm"
"745692268896595970","Wed Jun 22 18:57:45 +0000 2016","We should support our teachers, not scapegoat them. https://t.co/PlnHNleoQN"
"745694255767822336","Wed Jun 22 19:05:39 +0000 2016","Families shouldn’t have to spend more than 10% of their income on child care. https://t.co/EYR8iWoYfb"
"745695909103702016","Wed Jun 22 19:12:13 +0000 2016","We can’t let Trump bankrupt America the way he did his casinos.

We need a new chapter in the American Dream – and it can’t be Chapter 11."
"745726305971372032","Wed Jun 22 21:13:00 +0000 2016","No company in America should be able to pay women less for the work they do. https://t.co/2xsOoheJlp"
"745751853116325888","Wed Jun 22 22:54:31 +0000 2016","House Republicans may have cut the cameras, but they can't cut off our voices. We have to act on gun violence. -H https://t.co/lAj28YZDLY"
"745765814557638656","Wed Jun 22 23:50:00 +0000 2016","You*

*offer not valid for Muslims, women, Latinos, African Americans, LGBT Americans, middle-class families ... https://t.co/FTFYAyUFfp"
"745782613797969920","Thu Jun 23 00:56:45 +0000 2016","It’s ridiculous that teachers and nurses have a higher tax rate than many hedge fund managers. https://t.co/oZp5efgjzV"
"746007029546913792","Thu Jun 23 15:48:30 +0000 2016","Today's heartbreaking #SCOTUS immigration ruling could tear apart 5 million families facing deportation. We must do better. -H"
"746020796007591938","Thu Jun 23 16:43:12 +0000 2016","The Supreme Court's Fisher decision is a win for us all. The doors to higher education should be open to every American, not just some. -H"
"746063493573509120","Thu Jun 23 19:32:52 +0000 2016","44 years since #TitleIX passed, truer than ever: All students deserve equal opportunity, no matter their gender. https://t.co/4X7N9bxWWB"
"746073128644784128","Thu Jun 23 20:11:09 +0000 2016","Thank you, #DemocraticSitIn. Your determination has exposed Republican inaction on gun violence and demanded better. We can't give up. -H"
"746099306390659072","Thu Jun 23 21:55:11 +0000 2016","People in Scotland are not thrilled about Trump coming to their country.

We know the feeling.
https://t.co/M5NKiYnt4C"
"746135775327092736","Fri Jun 24 00:20:06 +0000 2016","We can’t let @realdonaldtrump bankrupt America the way he bankrupted his casinos.
https://t.co/RzHrHkvsoh"
"746153085488214016","Fri Jun 24 01:28:53 +0000 2016","...and many of them pay a lower tax rate. https://t.co/fy9pJL976G"
"746171897499508739","Fri Jun 24 02:43:38 +0000 2016","The fate of immigration reform—and millions of undocumented families—is in the hands of the next president. https://t.co/DvG1zUNNNi"
"746341305043783680","Fri Jun 24 13:56:48 +0000 2016","""We respect the choice the people of the United Kingdom have made."" —Hillary #BrexitVote https://t.co/58yM8oDkL6"
"746343756123738112","Fri Jun 24 14:06:32 +0000 2016","Our first task has to be to make sure that the economic uncertainty created by these events does not hurt working families. #BrexitVote"
"746352589407674368","Fri Jun 24 14:41:38 +0000 2016","""This time of uncertainty only underscores the need for calm, steady, experienced leadership in the White House."" —Hillary #BrexitVote"
"746406051747008513","Fri Jun 24 18:14:04 +0000 2016","Hours after the #BrexitVote, Donald Trump was in the U.K.

Talking about how he, personally, would benefit.
https://t.co/YEt5LozDpt"
"746424930179289089","Fri Jun 24 19:29:05 +0000 2016","Thank you, @POTUS, for marking another important milestone on LGBT Americans' march toward equality. -H https://t.co/KQVYhNDR8I"
"746437359382708225","Fri Jun 24 20:18:29 +0000 2016","Good for you, Jensen. Every woman deserves equal pay, no matter what her age. Keep up the hard work—and courage! https://t.co/F83gK5oZ6W -H"
"746476634182660101","Fri Jun 24 22:54:33 +0000 2016","LGBT kids are perfect the way they are. They deserve love and acceptance—not bullying and violence. https://t.co/3ICu66ozzV"
"746705594887737344","Sat Jun 25 14:04:21 +0000 2016",".@BarneyFrank on the time he marched in NYC's gay pride parade with the First Lady of the United States in 2000.
https://t.co/G1b5cUV0pJ"
"746724745996021760","Sat Jun 25 15:20:27 +0000 2016","In some states, LGBT Americans can get married on Saturday and fired on Monday. That's not who we are. https://t.co/5TjQnBbM3s"
"746750216762720256","Sat Jun 25 17:01:40 +0000 2016","LGBT seniors have seen so much progress, but still face discrimination. This has to change. https://t.co/fUCyqi07zY"
"746825486676877312","Sat Jun 25 22:00:46 +0000 2016","To the LGBT community: We're with you.

Love, @HFA.
https://t.co/4SP1d3s8nz"
"746856200113815552","Sun Jun 26 00:02:48 +0000 2016","We're going to keep fighting for equality, at home and around the world.
https://t.co/4JjtWshXRI"
"747081249118949376","Sun Jun 26 14:57:04 +0000 2016","One year later (still one of our favorite maps). https://t.co/JJMrMOtiQc"
"747114444514168832","Sun Jun 26 17:08:58 +0000 2016","Every LGBT American deserves to live, work, and marry free from discrimination or violence.
https://t.co/GQeL2HcI7l"
"747128992168292354","Sun Jun 26 18:06:47 +0000 2016","One year ago, love triumphed in our highest court. Yet LGBT Americans still face too many barriers. Let's keep marching until they don't. -H"
"747137246642442240","Sun Jun 26 18:39:35 +0000 2016","Happy #NYCPride! https://t.co/ZV75RMBiM2"
"747175708800188417","Sun Jun 26 21:12:25 +0000 2016","""There are more mass shootings in the United States than any other country in the world...We cannot accept this. Not now—not ever."" —Hillary"
"747176012610404352","Sun Jun 26 21:13:37 +0000 2016","No person should be gunned down while learning, teaching, praying, or dancing. It's time for us to come together to strengthen our gun laws."
"747177700251545600","Sun Jun 26 21:20:20 +0000 2016","Not even a sit-in in Congress could convince Republican leadership to move forward on gun violence prevention. Americans deserve better."
"747179548010254336","Sun Jun 26 21:27:40 +0000 2016","When you're in office Americans count on you for real solutions. You can’t respond with a snarky tweet—you have to actually deliver results."
"747204292742897664","Sun Jun 26 23:06:00 +0000 2016","Discrimination against LGBT people is all too common—and goes against everything we stand for as a country. https://t.co/CnOZdKXG0q"
"747432540672266240","Mon Jun 27 14:12:58 +0000 2016","SCOTUS's decision is a victory for women in Texas and across America. Safe abortion should be a right—not just on paper, but in reality. -H"
"747432851843481600","Mon Jun 27 14:14:13 +0000 2016","This fight isn't over: The next president has to protect women's health. Women won't be ""punished"" for exercising their basic rights. -H"
"747444345389875200","Mon Jun 27 14:59:53 +0000 2016","It's wrong that millionaires get more tax cuts while families are facing barriers to success.

This election is a chance to make it right."
"747446409796915202","Mon Jun 27 15:08:05 +0000 2016","We'll reward companies that share profits with employees and pay a good wage. If they can do it for executives, they can do it for workers."
"747449000857636864","Mon Jun 27 15:18:23 +0000 2016","Trump rails against other countries and talks about making America great, but his own products are made in places that aren’t named America."
"747449278109487104","Mon Jun 27 15:19:29 +0000 2016","Imagine Trump sitting in the Oval Office the next time America faces a crisis.

Imagine him in charge, with your job and savings at stake."
"747449853802909705","Mon Jun 27 15:21:46 +0000 2016","We are not going to let Donald Trump bankrupt America the way he bankrupted his casinos."
"747460630249013248","Mon Jun 27 16:04:36 +0000 2016","""Hillary believes that racism, hatred, injustice, and bigotry have no place in our country."" —@ElizabethforMA
https://t.co/OK5UueAaZn"
"747479209371701248","Mon Jun 27 17:18:25 +0000 2016","A great day to hit the campaign trail in Ohio with @ElizabethForMA. https://t.co/VizBSUNMxg"
"747513069874589696","Mon Jun 27 19:32:58 +0000 2016","""You can’t just talk someone into trusting you. You’ve got to earn it ... I believe what you say matters."" —Hillary https://t.co/0JaHehp9ig"
